{"IndenforParti":[{"PartiId":"914ae6fd-98a6-4ed6-afd1-60ab809678ed","PartiNavn":"Venstre, Danmarks Liberale Parti","Bogstavbetegnelse":"V","Stemmer":169,"Partistemmer":null,"StemmerDifferenceFraForrigeValg":null,"Kandidater":null},{"PartiId":"1df39501-e08d-42e9-9804-eccf7b1f564a","PartiNavn":"Dansk Folkeparti","Bogstavbetegnelse":"O","Stemmer":136,"Partistemmer":null,"StemmerDifferenceFraForrigeValg":null,"Kandidater":null},{"PartiId":"30375f1d-ff52-4b0d-9964-7147844cd5e7","PartiNavn":"Moderaterne","Bogstavbetegnelse":"M","Stemmer":86,"Partistemmer":null,"StemmerDifferenceFraForrigeValg":null,"Kandidater":null},{"PartiId":"8bb64864-5728-41db-af00-6234795cf340","PartiNavn":"Enhedslisten - De Rød-Grønne","Bogstavbetegnelse":"Ø","Stemmer":41,"Partistemmer":null,"StemmerDifferenceFraForrigeValg":null,"Kandidater":null},{"PartiId":"c01e1c81-e8eb-4f3d-ac55-de9279740a0e","PartiNavn":"Alternativet","Bogstavbetegnelse":"Å","Stemmer":16,"Partistemmer":null,"StemmerDifferenceFraForrigeValg":null,"Kandidater":null},{"PartiId":"fae32292-ff8f-4f27-8218-a9874603e759","PartiNavn":"SF - Socialistisk Folkeparti","Bogstavbetegnelse":"F","Stemmer":111,"Partistemmer":null,"StemmerDifferenceFraForrigeValg":null,"Kandidater":null},{"PartiId":"93a1aa01-2897-474b-8604-a1326c9b3948","PartiNavn":"Radikale Venstre","Bogstavbetegnelse":"B","Stemmer":47,"Partistemmer":null,"StemmerDifferenceFraForrigeValg":null,"Kandidater":null},{"PartiId":"2e08413e-1c5b-4029-8bce-eac0ebff6527","PartiNavn":"Det Konservative Folkeparti","Bogstavbetegnelse":"C","Stemmer":84,"Partistemmer":null,"StemmerDifferenceFraForrigeValg":null,"Kandidater":null},{"PartiId":"2f487db9-0663-429f-a4ec-081ae701723d","PartiNavn":"Socialdemokratiet","Bogstavbetegnelse":"A","Stemmer":322,"Partistemmer":null,"StemmerDifferenceFraForrigeValg":null,"Kandidater":null},{"PartiId":"4d676beb-025b-4d42-ac5d-533d5130a6f3","PartiNavn":"Liberal Alliance","Bogstavbetegnelse":"I","Stemmer":74,"Partistemmer":null,"StemmerDifferenceFraForrigeValg":null,"Kandidater":null},{"PartiId":"89ee100e-d4d6-43b5-83c5-edd5dd02c1fd","PartiNavn":"Borgernes Parti - Lars Boje Mathiesen","Bogstavbetegnelse":"H","Stemmer":28,"Partistemmer":null,"StemmerDifferenceFraForrigeValg":null,"Kandidater":null},{"PartiId":"ffacb8b3-7f7b-4158-a1ee-c0be84a344c6","PartiNavn":"Danmarksdemokraterne - Inger Støjberg","Bogstavbetegnelse":"Æ","Stemmer":66,"Partistemmer":null,"StemmerDifferenceFraForrigeValg":null,"Kandidater":null}],"UdenforParti":[],"Valgdag":"24-03-2026","Valgart":"Folketingsvalg","FrigivelsesTidspunktUTC":"24-03-2026 20:26:33","Storkreds":"Sydjylland","Storkredsnummer":7,"Opstillingskreds":"Haderslev","OpstillingskredsDagiId":403617,"Kommune":"Haderslev","Kommunekode":510,"AfstemningsområdeNummer":6,"AfstemningsområdeDagiId":709256,"Afstemningsområde":"Aastrup","UgyldigeFremmødteStemmerÅrsager":[{"Id":1,"Navn":"Blanke","Paragraf":"4","Antal":15},{"Id":14,"Navn":"AfmærketMedForskelligeFarverOgAndet","Paragraf":"17","Antal":0},{"Id":8,"Navn":"OverstregetUdvisketEllerIkkeFuldtKryds","Paragraf":"11","Antal":0},{"Id":3,"Navn":"HeltEllerDelvistOverstreget","Paragraf":"6","Antal":0},{"Id":10,"Navn":"StemmeseddelIkkeFraAfstemningssted","Paragraf":"13","Antal":0},{"Id":13,"Navn":"StemmeseddelMedTegningPåskrift","Paragraf":"16","Antal":0},{"Id":11,"Navn":"AndetMærkeEndKrydsForudenKryds","Paragraf":"14","Antal":0},{"Id":5,"Navn":"KrydsIflerePartifelter","Paragraf":"8","Antal":0},{"Id":2,"Navn":"AndetMærkeEndKryds","Paragraf":"5","Antal":0},{"Id":4,"Navn":"KrydsUdenForPartifelterne","Paragraf":"7","Antal":0},{"Id":7,"Navn":"KrydsUdForUdenForPartierne","Paragraf":"10","Antal":0},{"Id":6,"Navn":"KrydsRækkerIndIflerePartifelter","Paragraf":"9","Antal":0},{"Id":9,"Navn":"AndreGrunde","Paragraf":"12","Antal":0},{"Id":12,"Navn":"AnførtFlereEndTreKryds","Paragraf":"15","Antal":0}],"UgyldigeBrevstemmerÅrsager":[{"Id":21,"Navn":"Blanke","Paragraf":"19","Antal":2},{"Id":32,"Navn":"UdfyldtPåBagsidenEllerAndet","Paragraf":"31","Antal":0},{"Id":31,"Navn":"StemmeseddelMedTegningPåskrift","Paragraf":"30","Antal":0},{"Id":27,"Navn":"AndreGrunde","Paragraf":"26","Antal":0},{"Id":28,"Navn":"AndetEllerMereEndEnStemmeseddel","Paragraf":"27","Antal":0},{"Id":29,"Navn":"StemmeseddelIkkeFraMinisteren","Paragraf":"28","Antal":0},{"Id":26,"Navn":"ModstridBogstavPartiNavn","Paragraf":"24,25","Antal":0},{"Id":30,"Navn":"KonvolutMedPåskrift","Paragraf":"29","Antal":0},{"Id":24,"Navn":"KunUofficelBogstavPåFlereBogstaver","Paragraf":"22","Antal":0},{"Id":23,"Navn":"KunUofficelBogstavPåEtBogstav","Paragraf":"21","Antal":0},{"Id":25,"Navn":"KunKryds","Paragraf":"23","Antal":0},{"Id":22,"Navn":"KunNavnUofficielBogstav","Paragraf":"20","Antal":0}],"Resultatart":"ForeløbigOptælling","AfgivneStemmer":1197,"GyldigeStemmer":1180,"UgyldigeStemmerUdoverBlanke":0,"BlankeUgyldigeFremmødteStemmer":15,"BlankeUgyldigeBrevstemmer":2,"AfgivneStemmerDifferenceFraForrigeValg":null,"GyldigeStemmerDifferenceFraForrigeValg":null,"UgyldigeStemmerDifferenceFraForrigeValg":null,"BlankeStemmerDifferenceFraForrigeValg":null,"AntalStemmeberettigedeVælgereDifferenceFraForrigeValg":null,"AntalStemmeberettigedeVælgere":1328}