{"IndenforParti":[{"PartiId":"93a1aa01-2897-474b-8604-a1326c9b3948","PartiNavn":"Radikale Venstre","Bogstavbetegnelse":"B","Stemmer":4,"Partistemmer":null,"StemmerDifferenceFraForrigeValg":null,"Kandidater":null},{"PartiId":"ffacb8b3-7f7b-4158-a1ee-c0be84a344c6","PartiNavn":"Danmarksdemokraterne - Inger Støjberg","Bogstavbetegnelse":"Æ","Stemmer":82,"Partistemmer":null,"StemmerDifferenceFraForrigeValg":null,"Kandidater":null},{"PartiId":"2f487db9-0663-429f-a4ec-081ae701723d","PartiNavn":"Socialdemokratiet","Bogstavbetegnelse":"A","Stemmer":83,"Partistemmer":null,"StemmerDifferenceFraForrigeValg":null,"Kandidater":null},{"PartiId":"914ae6fd-98a6-4ed6-afd1-60ab809678ed","PartiNavn":"Venstre, Danmarks Liberale Parti","Bogstavbetegnelse":"V","Stemmer":124,"Partistemmer":null,"StemmerDifferenceFraForrigeValg":null,"Kandidater":null},{"PartiId":"2e08413e-1c5b-4029-8bce-eac0ebff6527","PartiNavn":"Det Konservative Folkeparti","Bogstavbetegnelse":"C","Stemmer":12,"Partistemmer":null,"StemmerDifferenceFraForrigeValg":null,"Kandidater":null},{"PartiId":"4d676beb-025b-4d42-ac5d-533d5130a6f3","PartiNavn":"Liberal Alliance","Bogstavbetegnelse":"I","Stemmer":69,"Partistemmer":null,"StemmerDifferenceFraForrigeValg":null,"Kandidater":null},{"PartiId":"fae32292-ff8f-4f27-8218-a9874603e759","PartiNavn":"SF - Socialistisk Folkeparti","Bogstavbetegnelse":"F","Stemmer":22,"Partistemmer":null,"StemmerDifferenceFraForrigeValg":null,"Kandidater":null},{"PartiId":"89ee100e-d4d6-43b5-83c5-edd5dd02c1fd","PartiNavn":"Borgernes Parti - Lars Boje Mathiesen","Bogstavbetegnelse":"H","Stemmer":28,"Partistemmer":null,"StemmerDifferenceFraForrigeValg":null,"Kandidater":null},{"PartiId":"1df39501-e08d-42e9-9804-eccf7b1f564a","PartiNavn":"Dansk Folkeparti","Bogstavbetegnelse":"O","Stemmer":63,"Partistemmer":null,"StemmerDifferenceFraForrigeValg":null,"Kandidater":null},{"PartiId":"30375f1d-ff52-4b0d-9964-7147844cd5e7","PartiNavn":"Moderaterne","Bogstavbetegnelse":"M","Stemmer":25,"Partistemmer":null,"StemmerDifferenceFraForrigeValg":null,"Kandidater":null},{"PartiId":"8bb64864-5728-41db-af00-6234795cf340","PartiNavn":"Enhedslisten - De Rød-Grønne","Bogstavbetegnelse":"Ø","Stemmer":3,"Partistemmer":null,"StemmerDifferenceFraForrigeValg":null,"Kandidater":null},{"PartiId":"c01e1c81-e8eb-4f3d-ac55-de9279740a0e","PartiNavn":"Alternativet","Bogstavbetegnelse":"Å","Stemmer":3,"Partistemmer":null,"StemmerDifferenceFraForrigeValg":null,"Kandidater":null}],"UdenforParti":[],"Valgdag":"24-03-2026","Valgart":"Folketingsvalg","FrigivelsesTidspunktUTC":"24-03-2026 19:36:16","Storkreds":"Sydjylland","Storkredsnummer":7,"Opstillingskreds":"Aabenraa","OpstillingskredsDagiId":403621,"Kommune":"Aabenraa","Kommunekode":580,"AfstemningsområdeNummer":2,"AfstemningsområdeDagiId":703772,"Afstemningsområde":"Hellevad","UgyldigeFremmødteStemmerÅrsager":[{"Id":1,"Navn":"Blanke","Paragraf":"4","Antal":5}],"UgyldigeBrevstemmerÅrsager":[{"Id":21,"Navn":"Blanke","Paragraf":"19","Antal":0}],"Resultatart":"ForeløbigOptælling","AfgivneStemmer":524,"GyldigeStemmer":518,"UgyldigeStemmerUdoverBlanke":1,"BlankeUgyldigeFremmødteStemmer":5,"BlankeUgyldigeBrevstemmer":0,"AfgivneStemmerDifferenceFraForrigeValg":null,"GyldigeStemmerDifferenceFraForrigeValg":null,"UgyldigeStemmerDifferenceFraForrigeValg":null,"BlankeStemmerDifferenceFraForrigeValg":null,"AntalStemmeberettigedeVælgereDifferenceFraForrigeValg":null,"AntalStemmeberettigedeVælgere":627}